{
  "$schema": "https://json-schema.org/draft/2020-12/schema",
  "$id": "https://arrowair.com/schemas/bounties.generated.schema.json",
  "title": "Arrow generated bounty board data",
  "type": "object",
  "additionalProperties": false,
  "required": ["engineering", "software", "growthMedia", "generalDao"],
  "properties": {
    "engineering": { "$ref": "#/$defs/bountyRows" },
    "software": { "$ref": "#/$defs/bountyRows" },
    "growthMedia": { "$ref": "#/$defs/bountyRows" },
    "generalDao": { "$ref": "#/$defs/bountyRows" }
  },
  "$defs": {
    "bountyRows": {
      "type": "array",
      "items": { "$ref": "#/$defs/bountyRow" }
    },
    "bountyRow": {
      "type": "object",
      "additionalProperties": false,
      "required": ["title", "description", "status"],
      "properties": {
        "title": { "type": "string", "minLength": 1 },
        "description": { "type": "string", "minLength": 1 },
        "status": { "enum": ["OPEN", "CLAIMED", "EXPIRED", "CLOSED"] },
        "usdc": { "type": "string", "minLength": 1 },
        "arrow": { "type": "string", "minLength": 1 },
        "expires": { "type": "string", "minLength": 1 },
        "expectedWindow": { "type": "string", "minLength": 1 },
        "skills": {
          "type": "array",
          "items": {
            "enum": [
              "Engineering",
              "CAD",
              "Electronics",
              "Software",
              "Documentation",
              "Design",
              "Media",
              "Research",
              "Testing",
              "Governance",
              "FEA",
              "CFD",
              "Python",
              "TypeScript",
              "Rust",
              "DevOps",
              "Writing",
              "Translation",
              "Video"
            ]
          },
          "uniqueItems": true
        },
        "posted": { "type": "string", "minLength": 1 },
        "issueUrl": { "type": "string", "format": "uri" },
        "applyUrl": { "type": "string", "format": "uri" },
        "detailUrl": { "type": "string", "minLength": 1 },
        "image": { "type": "string", "minLength": 1 }
      },
      "anyOf": [
        { "required": ["usdc"] },
        { "required": ["arrow"] }
      ]
    }
  }
}
